{
  "source": "Advanced_Fantasy_Referees_Tome_v1-3.md",
  "counts": {
    "dungeon_levels": 6,
    "dungeon_entries": 240,
    "terrain_types": 10,
    "sub_tables": 11
  },
  "dungeon": {
    "1": {
      "1/0": {
        "monster": "Acolyte",
        "number": "1d8"
      },
      "1/1": {
        "monster": "Bandit",
        "number": "1d8"
      },
      "1/2": {
        "monster": "Beetle, Fire",
        "number": "1d8"
      },
      "1/3": {
        "monster": "Beetle, Oil",
        "number": "1d3"
      },
      "1/4": {
        "monster": "Berserker",
        "number": "1d4"
      },
      "1/5": {
        "monster": "Brown Mould",
        "number": "1d3"
      },
      "1/6": {
        "monster": "Brownie",
        "number": "3d6"
      },
      "1/7": {
        "monster": "Dark Creeper",
        "number": "1"
      },
      "1/8": {
        "monster": "Dog, Wild",
        "number": "2d6"
      },
      "1/9": {
        "monster": "Dwarf",
        "number": "1d6"
      },
      "2/0": {
        "monster": "Frog, Mutant",
        "number": "3d6"
      },
      "2/1": {
        "monster": "Gas Spore",
        "number": "1d3"
      },
      "2/2": {
        "monster": "Gnome",
        "number": "1d6"
      },
      "2/3": {
        "monster": "Goblin",
        "number": "2d4"
      },
      "2/4": {
        "monster": "Green Slime",
        "number": "1d4"
      },
      "2/5": {
        "monster": "Gullygug",
        "number": "2d6"
      },
      "2/6": {
        "monster": "Halfling",
        "number": "3d6"
      },
      "2/7": {
        "monster": "Homunculus",
        "number": "1"
      },
      "2/8": {
        "monster": "Killer Bee",
        "number": "1d10"
      },
      "2/9": {
        "monster": "Kobold",
        "number": "4d4"
      },
      "3/0": {
        "monster": "Leprechaun",
        "number": "1"
      },
      "3/1": {
        "monster": "Lizard, Gecko",
        "number": "1d3"
      },
      "3/2": {
        "monster": "Mutoid",
        "number": "1d8"
      },
      "3/3": {
        "monster": "Necrophidius",
        "number": "1"
      },
      "3/4": {
        "monster": "Orc",
        "number": "2d4"
      },
      "3/5": {
        "monster": "Piercer",
        "hd": "1",
        "number": "3d6"
      },
      "3/6": {
        "monster": "Poltergeist",
        "number": "1d3"
      },
      "3/7": {
        "monster": "Robber Fly",
        "number": "1d3"
      },
      "3/8": {
        "monster": "Rot Grub",
        "number": "5d4"
      },
      "3/9": {
        "monster": "Shrew, Giant",
        "number": "1d10"
      },
      "4/0": {
        "monster": "Skeleton",
        "number": "3d4"
      },
      "4/1": {
        "monster": "Snake, Cobra",
        "number": "1d6"
      },
      "4/2": {
        "monster": "Spider, Crab",
        "number": "1d4"
      },
      "4/3": {
        "monster": "Sprite",
        "number": "3d6"
      },
      "4/4": {
        "monster": "Stirge",
        "number": "1d10"
      },
      "4/5": {
        "monster": "Toad, Poisonous",
        "number": "1d4"
      },
      "4/6": {
        "monster": "Trader",
        "number": "1d8"
      },
      "4/7": {
        "monster": "Troglodyte",
        "number": "1d4"
      },
      "4/8": {
        "monster": "Wolf",
        "number": "2d6"
      },
      "4/9": {
        "monster": "Zombie",
        "number": "1d4"
      }
    },
    "2": {
      "1/0": {
        "monster": "Ankheg",
        "hd": "3",
        "number": "1d2"
      },
      "1/1": {
        "monster": "Beetle, Oil",
        "number": "1d8"
      },
      "1/2": {
        "monster": "Berserker",
        "number": "1d6"
      },
      "1/3": {
        "monster": "Brown Mould",
        "number": "1d8"
      },
      "1/4": {
        "monster": "Cat, Mntn. Lion",
        "number": "1d4"
      },
      "1/5": {
        "monster": "Coffer Corpse",
        "number": "1"
      },
      "1/6": {
        "monster": "Dark Creeper",
        "number": "1"
      },
      "1/7": {
        "monster": "Dog, Wild",
        "number": "2d6"
      },
      "1/8": {
        "monster": "Elf",
        "number": "1d4"
      },
      "1/9": {
        "monster": "Frog, Poisonous",
        "number": "1d6"
      },
      "2/0": {
        "monster": "Gas Spore",
        "number": "1d3"
      },
      "2/1": {
        "monster": "Ghoul",
        "number": "1d6"
      },
      "2/2": {
        "monster": "Gnoll",
        "number": "1d6"
      },
      "2/3": {
        "monster": "Grey Ooze",
        "number": "1"
      },
      "2/4": {
        "monster": "Gullygug",
        "number": "2d6"
      },
      "2/5": {
        "monster": "Hobgoblin",
        "number": "1d6"
      },
      "2/6": {
        "monster": "Homunculus",
        "number": "1"
      },
      "2/7": {
        "monster": "Lizard Man",
        "number": "2d4"
      },
      "2/8": {
        "monster": "Lizard, Draco",
        "number": "1d4"
      },
      "2/9": {
        "monster": "Lycan., Wererat",
        "number": "1d4"
      },
      "3/0": {
        "monster": "Mutoid",
        "number": "2d6"
      },
      "3/1": {
        "monster": "Mycelian",
        "number": "1d12"
      },
      "3/2": {
        "monster": "Neanderthal",
        "number": "1d10"
      },
      "3/3": {
        "monster": "Necrophidius",
        "number": "1"
      },
      "3/4": {
        "monster": "Noble",
        "number": "2d6"
      },
      "3/5": {
        "monster": "Piercer",
        "hd": "2",
        "number": "3d8"
      },
      "3/6": {
        "monster": "Pixie",
        "number": "2d4"
      },
      "3/7": {
        "monster": "Poltergeist",
        "number": "1d8"
      },
      "3/8": {
        "monster": "Pseudo-Dragon",
        "number": "1"
      },
      "3/9": {
        "monster": "Robber Fly",
        "number": "1d6"
      },
      "4/0": {
        "monster": "Rock Baboon",
        "number": "2d6"
      },
      "4/1": {
        "monster": "Rot Grub",
        "number": "5d6"
      },
      "4/2": {
        "monster": "Snake, Pit Viper",
        "number": "1d8"
      },
      "4/3": {
        "monster": "Spider, Bl. Widow",
        "number": "1d3"
      },
      "4/4": {
        "monster": "Toad, Poisonous",
        "number": "1d8"
      },
      "4/5": {
        "monster": "Troglodyte",
        "number": "1d8"
      },
      "4/6": {
        "monster": "Veteran",
        "number": "2d4"
      },
      "4/7": {
        "monster": "Violet Fungus",
        "number": "1d2"
      },
      "4/8": {
        "monster": "Water Fiend",
        "number": "1"
      },
      "4/9": {
        "monster": "Zombie",
        "number": "2d4"
      }
    },
    "3": {
      "1/0": {
        "monster": "Ankheg",
        "hd": "3",
        "number": "1d6"
      },
      "1/1": {
        "monster": "Ape, White",
        "number": "1d6"
      },
      "1/2": {
        "monster": "Basic Adv.",
        "number": "1d4+4"
      },
      "1/3": {
        "monster": "Beetle, Tiger",
        "number": "1d6"
      },
      "1/4": {
        "monster": "Brown Mould",
        "number": "1d10"
      },
      "1/5": {
        "monster": "Bugbear",
        "number": "2d4"
      },
      "1/6": {
        "monster": "Carcass Crawler",
        "number": "1d3"
      },
      "1/7": {
        "monster": "Coffer Corpse",
        "number": "1d3"
      },
      "1/8": {
        "monster": "Dark Creeper",
        "number": "1d4"
      },
      "1/9": {
        "monster": "Deep One",
        "number": "2d12"
      },
      "2/0": {
        "monster": "Doppelg\u00e4nger",
        "number": "1d6"
      },
      "2/1": {
        "monster": "Driver Ant",
        "number": "2d4"
      },
      "2/2": {
        "monster": "Drow",
        "number": "2d4"
      },
      "2/3": {
        "monster": "Duergar",
        "number": "2d6"
      },
      "2/4": {
        "monster": "Flail Snail",
        "number": "1"
      },
      "2/5": {
        "monster": "Gargoyle",
        "number": "1d6"
      },
      "2/6": {
        "monster": "Gas Spore",
        "number": "1d3"
      },
      "2/7": {
        "monster": "Gelatinous Cube",
        "number": "1"
      },
      "2/8": {
        "monster": "Ghast",
        "number": "1"
      },
      "2/9": {
        "monster": "Harpy",
        "number": "1d6"
      },
      "3/0": {
        "monster": "Lvng. Stat., Crystal",
        "number": "1d6"
      },
      "3/1": {
        "monster": "Lycan., Wererat",
        "number": "1d8"
      },
      "3/2": {
        "monster": "Medium",
        "number": "1d4"
      },
      "3/3": {
        "monster": "Medusa",
        "number": "1d3"
      },
      "3/4": {
        "monster": "Mutoid",
        "number": "2d8"
      },
      "3/5": {
        "monster": "Mycelian",
        "number": "2d8"
      },
      "3/6": {
        "monster": "Necrophidius",
        "number": "1d3"
      },
      "3/7": {
        "monster": "Ochre Jelly",
        "number": "1"
      },
      "3/8": {
        "monster": "Ogre",
        "number": "1d6"
      },
      "3/9": {
        "monster": "Piercer",
        "hd": "3",
        "number": "4d6"
      },
      "4/0": {
        "monster": "Poltergeist",
        "number": "2d6"
      },
      "4/1": {
        "monster": "Rot Grub",
        "number": "5d6"
      },
      "4/2": {
        "monster": "Shadow",
        "number": "1d8"
      },
      "4/3": {
        "monster": "Spider, Tarantella",
        "number": "1d3"
      },
      "4/4": {
        "monster": "Svirfneblin",
        "number": "2d8"
      },
      "4/5": {
        "monster": "Thoul",
        "number": "1d6"
      },
      "4/6": {
        "monster": "Toad, Poisonous",
        "number": "2d6"
      },
      "4/7": {
        "monster": "Violet Fungus",
        "number": "1d4"
      },
      "4/8": {
        "monster": "Water Fiend",
        "number": "1d3"
      },
      "4/9": {
        "monster": "Wight",
        "number": "1d6"
      }
    },
    "4-5": {